
         /\      Grafana   /‾‾/  
    /\  /  \     |\  __   /  /   
   /  \/    \    | |/ /  /   ‾‾\ 
  /          \   |   (  |  (‾)  |
 / __________ \  |_|\_\  \_____/ 

     execution: local
        script: script.js
        output: -

     scenarios: (100.00%) 1 scenario, 20 max VUs, 1m30s max duration (incl. graceful stop):
              * default: 20 looping VUs for 1m0s (gracefulStop: 30s)


running (0m01.0s), 20/20 VUs, 0 complete and 0 interrupted iterations
default   [   2% ] 20 VUs  0m01.0s/1m0s

running (0m02.0s), 20/20 VUs, 0 complete and 0 interrupted iterations
default   [   3% ] 20 VUs  0m02.0s/1m0s

running (0m03.0s), 20/20 VUs, 0 complete and 0 interrupted iterations
default   [   5% ] 20 VUs  0m03.0s/1m0s

running (0m04.0s), 20/20 VUs, 0 complete and 0 interrupted iterations
default   [   7% ] 20 VUs  0m04.0s/1m0s

running (0m05.0s), 20/20 VUs, 0 complete and 0 interrupted iterations
default   [   8% ] 20 VUs  0m05.0s/1m0s

running (0m06.0s), 20/20 VUs, 0 complete and 0 interrupted iterations
default   [  10% ] 20 VUs  0m06.0s/1m0s

running (0m07.0s), 20/20 VUs, 0 complete and 0 interrupted iterations
default   [  12% ] 20 VUs  0m07.0s/1m0s

running (0m08.0s), 20/20 VUs, 0 complete and 0 interrupted iterations
default   [  13% ] 20 VUs  0m08.0s/1m0s

running (0m09.0s), 20/20 VUs, 0 complete and 0 interrupted iterations
default   [  15% ] 20 VUs  0m09.0s/1m0s

running (0m10.0s), 20/20 VUs, 0 complete and 0 interrupted iterations
default   [  17% ] 20 VUs  0m10.0s/1m0s

running (0m11.0s), 20/20 VUs, 0 complete and 0 interrupted iterations
default   [  18% ] 20 VUs  0m11.0s/1m0s

running (0m12.0s), 20/20 VUs, 0 complete and 0 interrupted iterations
default   [  20% ] 20 VUs  0m12.0s/1m0s

running (0m13.0s), 20/20 VUs, 0 complete and 0 interrupted iterations
default   [  22% ] 20 VUs  0m13.0s/1m0s

running (0m14.0s), 20/20 VUs, 0 complete and 0 interrupted iterations
default   [  23% ] 20 VUs  0m14.0s/1m0s

running (0m15.0s), 20/20 VUs, 0 complete and 0 interrupted iterations
default   [  25% ] 20 VUs  0m15.0s/1m0s

running (0m16.0s), 20/20 VUs, 0 complete and 0 interrupted iterations
default   [  27% ] 20 VUs  0m16.0s/1m0s

running (0m17.0s), 20/20 VUs, 20 complete and 0 interrupted iterations
default   [  28% ] 20 VUs  0m17.0s/1m0s

running (0m18.0s), 20/20 VUs, 20 complete and 0 interrupted iterations
default   [  30% ] 20 VUs  0m18.0s/1m0s

running (0m19.0s), 20/20 VUs, 24 complete and 0 interrupted iterations
default   [  32% ] 20 VUs  0m19.0s/1m0s

running (0m20.0s), 20/20 VUs, 28 complete and 0 interrupted iterations
default   [  33% ] 20 VUs  0m20.0s/1m0s

running (0m21.0s), 20/20 VUs, 31 complete and 0 interrupted iterations
default   [  35% ] 20 VUs  0m21.0s/1m0s

running (0m22.0s), 20/20 VUs, 35 complete and 0 interrupted iterations
default   [  37% ] 20 VUs  0m22.0s/1m0s

running (0m23.0s), 20/20 VUs, 39 complete and 0 interrupted iterations
default   [  38% ] 20 VUs  0m23.0s/1m0s

running (0m24.0s), 20/20 VUs, 39 complete and 0 interrupted iterations
default   [  40% ] 20 VUs  0m24.0s/1m0s

running (0m25.0s), 20/20 VUs, 46 complete and 0 interrupted iterations
default   [  42% ] 20 VUs  0m25.0s/1m0s

running (0m26.0s), 20/20 VUs, 59 complete and 0 interrupted iterations
default   [  43% ] 20 VUs  0m26.0s/1m0s

running (0m27.0s), 20/20 VUs, 63 complete and 0 interrupted iterations
default   [  45% ] 20 VUs  0m27.0s/1m0s

running (0m28.0s), 20/20 VUs, 63 complete and 0 interrupted iterations
default   [  47% ] 20 VUs  0m28.0s/1m0s

running (0m29.0s), 20/20 VUs, 70 complete and 0 interrupted iterations
default   [  48% ] 20 VUs  0m29.0s/1m0s

running (0m30.0s), 20/20 VUs, 74 complete and 0 interrupted iterations
default   [  50% ] 20 VUs  0m30.0s/1m0s

running (0m31.0s), 20/20 VUs, 74 complete and 0 interrupted iterations
default   [  52% ] 20 VUs  0m31.0s/1m0s

running (0m32.0s), 20/20 VUs, 76 complete and 0 interrupted iterations
default   [  53% ] 20 VUs  0m32.0s/1m0s

running (0m33.0s), 20/20 VUs, 85 complete and 0 interrupted iterations
default   [  55% ] 20 VUs  0m33.0s/1m0s

running (0m34.0s), 20/20 VUs, 85 complete and 0 interrupted iterations
default   [  57% ] 20 VUs  0m34.0s/1m0s

running (0m35.0s), 20/20 VUs, 89 complete and 0 interrupted iterations
default   [  58% ] 20 VUs  0m35.0s/1m0s

running (0m36.0s), 20/20 VUs, 102 complete and 0 interrupted iterations
default   [  60% ] 20 VUs  0m36.0s/1m0s

running (0m37.0s), 20/20 VUs, 105 complete and 0 interrupted iterations
default   [  62% ] 20 VUs  0m37.0s/1m0s

running (0m38.0s), 20/20 VUs, 109 complete and 0 interrupted iterations
default   [  63% ] 20 VUs  0m38.0s/1m0s

running (0m39.0s), 20/20 VUs, 113 complete and 0 interrupted iterations
default   [  65% ] 20 VUs  0m39.0s/1m0s

running (0m40.0s), 20/20 VUs, 113 complete and 0 interrupted iterations
default   [  67% ] 20 VUs  0m40.0s/1m0s

running (0m41.0s), 20/20 VUs, 120 complete and 0 interrupted iterations
default   [  68% ] 20 VUs  0m41.0s/1m0s

running (0m42.0s), 20/20 VUs, 124 complete and 0 interrupted iterations
default   [  70% ] 20 VUs  0m42.0s/1m0s

running (0m43.0s), 20/20 VUs, 128 complete and 0 interrupted iterations
default   [  72% ] 20 VUs  0m43.0s/1m0s

running (0m44.0s), 20/20 VUs, 128 complete and 0 interrupted iterations
default   [  73% ] 20 VUs  0m44.0s/1m0s

running (0m45.0s), 20/20 VUs, 135 complete and 0 interrupted iterations
default   [  75% ] 20 VUs  0m45.0s/1m0s

running (0m46.0s), 20/20 VUs, 148 complete and 0 interrupted iterations
default   [  77% ] 20 VUs  0m46.0s/1m0s

running (0m47.0s), 20/20 VUs, 148 complete and 0 interrupted iterations
default   [  78% ] 20 VUs  0m47.0s/1m0s

running (0m48.0s), 20/20 VUs, 148 complete and 0 interrupted iterations
default   [  80% ] 20 VUs  0m48.0s/1m0s

running (0m49.0s), 20/20 VUs, 159 complete and 0 interrupted iterations
default   [  82% ] 20 VUs  0m49.0s/1m0s

running (0m50.0s), 20/20 VUs, 159 complete and 0 interrupted iterations
default   [  83% ] 20 VUs  0m50.0s/1m0s

running (0m51.0s), 20/20 VUs, 159 complete and 0 interrupted iterations
default   [  85% ] 20 VUs  0m51.0s/1m0s

running (0m52.0s), 20/20 VUs, 167 complete and 0 interrupted iterations
default   [  87% ] 20 VUs  0m52.0s/1m0s

running (0m53.0s), 20/20 VUs, 169 complete and 0 interrupted iterations
default   [  88% ] 20 VUs  0m53.0s/1m0s

running (0m54.0s), 20/20 VUs, 170 complete and 0 interrupted iterations
default   [  90% ] 20 VUs  0m54.0s/1m0s

running (0m55.0s), 20/20 VUs, 174 complete and 0 interrupted iterations
default   [  92% ] 20 VUs  0m55.0s/1m0s

running (0m56.0s), 20/20 VUs, 178 complete and 0 interrupted iterations
default   [  93% ] 20 VUs  0m56.0s/1m0s

running (0m57.0s), 20/20 VUs, 187 complete and 0 interrupted iterations
default   [  95% ] 20 VUs  0m57.0s/1m0s

running (0m58.0s), 20/20 VUs, 194 complete and 0 interrupted iterations
default   [  97% ] 20 VUs  0m58.0s/1m0s

running (0m59.0s), 20/20 VUs, 194 complete and 0 interrupted iterations
default   [  98% ] 20 VUs  0m59.0s/1m0s

running (1m00.0s), 20/20 VUs, 198 complete and 0 interrupted iterations
default   [ 100% ] 20 VUs  1m00.0s/1m0s

running (1m01.0s), 20/20 VUs, 198 complete and 0 interrupted iterations
default ↓ [ 100% ] 20 VUs  1m0s

running (1m02.0s), 16/20 VUs, 202 complete and 0 interrupted iterations
default ↓ [ 100% ] 20 VUs  1m0s

running (1m03.0s), 11/20 VUs, 207 complete and 0 interrupted iterations
default ↓ [ 100% ] 20 VUs  1m0s

running (1m04.0s), 09/20 VUs, 209 complete and 0 interrupted iterations
default ↓ [ 100% ] 20 VUs  1m0s

running (1m05.0s), 09/20 VUs, 209 complete and 0 interrupted iterations
default ↓ [ 100% ] 20 VUs  1m0s

running (1m05.9s), 00/20 VUs, 218 complete and 0 interrupted iterations
default ✓ [ 100% ] 20 VUs  1m0s


  █ TOTAL RESULTS 

    HTTP
    http_req_duration..............: avg=1.41ms min=192.07µs med=859.11µs max=510.35ms p(90)=2.8ms  p(95)=3.72ms
      { expected_response:true }...: avg=1.41ms min=192.07µs med=859.11µs max=510.35ms p(90)=2.8ms  p(95)=3.72ms
    http_req_failed................: 0.00%  0 out of 872436
    http_reqs......................: 872436 13231.953793/s

    EXECUTION
    iteration_duration.............: avg=5.86s  min=2.61s    med=3.71s    max=16.23s   p(90)=10.69s p(95)=16.23s
    iterations.....................: 218    3.306335/s
    vus............................: 9      min=9           max=20
    vus_max........................: 20     min=20          max=20

    NETWORK
    data_received..................: 1.5 GB 23 MB/s
    data_sent......................: 74 MB  1.1 MB/s




running (1m05.9s), 00/20 VUs, 218 complete and 0 interrupted iterations
default ✓ [ 100% ] 20 VUs  1m0s
