
         /\      Grafana   /‾‾/  
    /\  /  \     |\  __   /  /   
   /  \/    \    | |/ /  /   ‾‾\ 
  /          \   |   (  |  (‾)  |
 / __________ \  |_|\_\  \_____/ 

     execution: local
        script: script.js
        output: -

     scenarios: (100.00%) 1 scenario, 20 max VUs, 1m30s max duration (incl. graceful stop):
              * default: 20 looping VUs for 1m0s (gracefulStop: 30s)


running (0m01.0s), 20/20 VUs, 0 complete and 0 interrupted iterations
default   [   2% ] 20 VUs  0m01.0s/1m0s

running (0m02.0s), 20/20 VUs, 0 complete and 0 interrupted iterations
default   [   3% ] 20 VUs  0m02.0s/1m0s

running (0m03.0s), 20/20 VUs, 0 complete and 0 interrupted iterations
default   [   5% ] 20 VUs  0m03.0s/1m0s

running (0m04.0s), 20/20 VUs, 0 complete and 0 interrupted iterations
default   [   7% ] 20 VUs  0m04.0s/1m0s

running (0m05.0s), 20/20 VUs, 0 complete and 0 interrupted iterations
default   [   8% ] 20 VUs  0m05.0s/1m0s

running (0m06.0s), 20/20 VUs, 0 complete and 0 interrupted iterations
default   [  10% ] 20 VUs  0m06.0s/1m0s

running (0m07.0s), 20/20 VUs, 0 complete and 0 interrupted iterations
default   [  12% ] 20 VUs  0m07.0s/1m0s

running (0m08.0s), 20/20 VUs, 0 complete and 0 interrupted iterations
default   [  13% ] 20 VUs  0m08.0s/1m0s

running (0m09.0s), 20/20 VUs, 0 complete and 0 interrupted iterations
default   [  15% ] 20 VUs  0m09.0s/1m0s

running (0m10.0s), 20/20 VUs, 0 complete and 0 interrupted iterations
default   [  17% ] 20 VUs  0m10.0s/1m0s

running (0m11.0s), 20/20 VUs, 0 complete and 0 interrupted iterations
default   [  18% ] 20 VUs  0m11.0s/1m0s

running (0m12.0s), 20/20 VUs, 0 complete and 0 interrupted iterations
default   [  20% ] 20 VUs  0m12.0s/1m0s

running (0m13.0s), 20/20 VUs, 0 complete and 0 interrupted iterations
default   [  22% ] 20 VUs  0m13.0s/1m0s

running (0m14.0s), 20/20 VUs, 0 complete and 0 interrupted iterations
default   [  23% ] 20 VUs  0m14.0s/1m0s

running (0m15.0s), 20/20 VUs, 0 complete and 0 interrupted iterations
default   [  25% ] 20 VUs  0m15.0s/1m0s

running (0m16.0s), 20/20 VUs, 0 complete and 0 interrupted iterations
default   [  27% ] 20 VUs  0m16.0s/1m0s

running (0m17.0s), 20/20 VUs, 0 complete and 0 interrupted iterations
default   [  28% ] 20 VUs  0m17.0s/1m0s

running (0m18.0s), 20/20 VUs, 0 complete and 0 interrupted iterations
default   [  30% ] 20 VUs  0m18.0s/1m0s

running (0m19.0s), 20/20 VUs, 0 complete and 0 interrupted iterations
default   [  32% ] 20 VUs  0m19.0s/1m0s

running (0m20.0s), 20/20 VUs, 0 complete and 0 interrupted iterations
default   [  33% ] 20 VUs  0m20.0s/1m0s

running (0m21.0s), 20/20 VUs, 20 complete and 0 interrupted iterations
default   [  35% ] 20 VUs  0m21.0s/1m0s

running (0m22.0s), 20/20 VUs, 20 complete and 0 interrupted iterations
default   [  37% ] 20 VUs  0m22.0s/1m0s

running (0m23.0s), 20/20 VUs, 20 complete and 0 interrupted iterations
default   [  38% ] 20 VUs  0m23.0s/1m0s

running (0m24.0s), 20/20 VUs, 20 complete and 0 interrupted iterations
default   [  40% ] 20 VUs  0m24.0s/1m0s

running (0m25.0s), 20/20 VUs, 24 complete and 0 interrupted iterations
default   [  42% ] 20 VUs  0m25.0s/1m0s

running (0m26.0s), 20/20 VUs, 24 complete and 0 interrupted iterations
default   [  43% ] 20 VUs  0m26.0s/1m0s

running (0m27.0s), 20/20 VUs, 35 complete and 0 interrupted iterations
default   [  45% ] 20 VUs  0m27.0s/1m0s

running (0m28.0s), 20/20 VUs, 40 complete and 0 interrupted iterations
default   [  47% ] 20 VUs  0m28.0s/1m0s

running (0m29.0s), 20/20 VUs, 44 complete and 0 interrupted iterations
default   [  48% ] 20 VUs  0m29.0s/1m0s

running (0m30.0s), 20/20 VUs, 44 complete and 0 interrupted iterations
default   [  50% ] 20 VUs  0m30.0s/1m0s

running (0m31.0s), 20/20 VUs, 47 complete and 0 interrupted iterations
default   [  52% ] 20 VUs  0m31.0s/1m0s

running (0m32.0s), 20/20 VUs, 59 complete and 0 interrupted iterations
default   [  53% ] 20 VUs  0m32.0s/1m0s

running (0m33.0s), 20/20 VUs, 59 complete and 0 interrupted iterations
default   [  55% ] 20 VUs  0m33.0s/1m0s

running (0m34.0s), 20/20 VUs, 64 complete and 0 interrupted iterations
default   [  57% ] 20 VUs  0m34.0s/1m0s

running (0m35.0s), 20/20 VUs, 71 complete and 0 interrupted iterations
default   [  58% ] 20 VUs  0m35.0s/1m0s

running (0m36.0s), 20/20 VUs, 71 complete and 0 interrupted iterations
default   [  60% ] 20 VUs  0m36.0s/1m0s

running (0m37.0s), 20/20 VUs, 75 complete and 0 interrupted iterations
default   [  62% ] 20 VUs  0m37.0s/1m0s

running (0m38.0s), 20/20 VUs, 83 complete and 0 interrupted iterations
default   [  63% ] 20 VUs  0m38.0s/1m0s

running (0m39.0s), 20/20 VUs, 86 complete and 0 interrupted iterations
default   [  65% ] 20 VUs  0m39.0s/1m0s

running (0m40.0s), 20/20 VUs, 86 complete and 0 interrupted iterations
default   [  67% ] 20 VUs  0m40.0s/1m0s

running (0m41.0s), 20/20 VUs, 91 complete and 0 interrupted iterations
default   [  68% ] 20 VUs  0m41.0s/1m0s

running (0m42.0s), 20/20 VUs, 99 complete and 0 interrupted iterations
default   [  70% ] 20 VUs  0m42.0s/1m0s

running (0m43.0s), 20/20 VUs, 106 complete and 0 interrupted iterations
default   [  72% ] 20 VUs  0m43.0s/1m0s

running (0m44.0s), 20/20 VUs, 106 complete and 0 interrupted iterations
default   [  73% ] 20 VUs  0m44.0s/1m0s

running (0m45.0s), 20/20 VUs, 106 complete and 0 interrupted iterations
default   [  75% ] 20 VUs  0m45.0s/1m0s

running (0m46.0s), 20/20 VUs, 110 complete and 0 interrupted iterations
default   [  77% ] 20 VUs  0m46.0s/1m0s

running (0m47.0s), 20/20 VUs, 110 complete and 0 interrupted iterations
default   [  78% ] 20 VUs  0m47.0s/1m0s

running (0m48.0s), 20/20 VUs, 115 complete and 0 interrupted iterations
default   [  80% ] 20 VUs  0m48.0s/1m0s

running (0m49.0s), 20/20 VUs, 128 complete and 0 interrupted iterations
default   [  82% ] 20 VUs  0m49.0s/1m0s

running (0m50.0s), 20/20 VUs, 130 complete and 0 interrupted iterations
default   [  83% ] 20 VUs  0m50.0s/1m0s

running (0m51.0s), 20/20 VUs, 130 complete and 0 interrupted iterations
default   [  85% ] 20 VUs  0m51.0s/1m0s

running (0m52.0s), 20/20 VUs, 130 complete and 0 interrupted iterations
default   [  87% ] 20 VUs  0m52.0s/1m0s

running (0m53.0s), 20/20 VUs, 137 complete and 0 interrupted iterations
default   [  88% ] 20 VUs  0m53.0s/1m0s

running (0m54.0s), 20/20 VUs, 150 complete and 0 interrupted iterations
default   [  90% ] 20 VUs  0m54.0s/1m0s

running (0m55.0s), 20/20 VUs, 150 complete and 0 interrupted iterations
default   [  92% ] 20 VUs  0m55.0s/1m0s

running (0m56.0s), 20/20 VUs, 154 complete and 0 interrupted iterations
default   [  93% ] 20 VUs  0m56.0s/1m0s

running (0m57.0s), 20/20 VUs, 157 complete and 0 interrupted iterations
default   [  95% ] 20 VUs  0m57.0s/1m0s

running (0m58.0s), 20/20 VUs, 157 complete and 0 interrupted iterations
default   [  97% ] 20 VUs  0m58.0s/1m0s

running (0m59.0s), 20/20 VUs, 163 complete and 0 interrupted iterations
default   [  98% ] 20 VUs  0m59.0s/1m0s

running (1m00.0s), 20/20 VUs, 169 complete and 0 interrupted iterations
default   [ 100% ] 20 VUs  1m00.0s/1m0s

running (1m01.0s), 14/20 VUs, 175 complete and 0 interrupted iterations
default ↓ [ 100% ] 20 VUs  1m0s

running (1m02.0s), 12/20 VUs, 177 complete and 0 interrupted iterations
default ↓ [ 100% ] 20 VUs  1m0s

running (1m03.0s), 08/20 VUs, 181 complete and 0 interrupted iterations
default ↓ [ 100% ] 20 VUs  1m0s


  █ TOTAL RESULTS 

    HTTP
    http_req_duration..............: avg=1.59ms min=137.53µs med=1.09ms max=209.84ms p(90)=2.35ms p(95)=4.32ms
      { expected_response:true }...: avg=1.59ms min=137.53µs med=1.09ms max=209.84ms p(90)=2.35ms p(95)=4.32ms
    http_req_failed................: 0.00%  0 out of 756378
    http_reqs......................: 756378 11910.101919/s

    EXECUTION
    iteration_duration.............: avg=6.55s  min=2.99s    med=5.07s  max=20.99s   p(90)=20.98s p(95)=20.99s
    iterations.....................: 189    2.976037/s
    vus............................: 8      min=8           max=20
    vus_max........................: 20     min=20          max=20

    NETWORK
    data_received..................: 1.3 GB 20 MB/s
    data_sent......................: 64 MB  1.0 MB/s




running (1m03.5s), 00/20 VUs, 189 complete and 0 interrupted iterations
default ✓ [ 100% ] 20 VUs  1m0s
